{"schema_version":"holocron-tolerance-pilot/v1","generated_at_utc":"2026-09-18T00:01:55.986605Z","source_revision":"bdd5b6eac6e86039f5adbc8ab81afcbc90014f12","source_is_dirty":false,"environment":{"operating_system":"Darwin","operating_system_release":"24.6.0","machine":"arm64","python_implementation":"CPython","python_version":"3.12.14","numpy_version":"2.5.3","blas":"accelerate unknown","lapack":"accelerate unknown"},"oracle":{"package":"rms","version":"8.2-0","commit":"a4e4a305a029090e737562fb4d35bdb705db7d63","protocol_version":"1"},"policy":{"path":"reference/tolerances.json","sha256":"6809ba3f7ac364ec378eaff42c51a80aeae883ab3e7cf2f6933e7653c65fc6d8","accepted_profiles":["deterministic-transform-v1","well-conditioned-ols-v1"]},"cases":[{"case_id":"ols-rcs-asymmetric","profile":"well-conditioned-ols-v1","outcome":"passed","exact_comparisons":19,"numeric_comparisons":81,"maximum_absolute_error":1.9984014443252818e-14,"maximum_relative_error":5.709576766087548e-14,"mismatches":[]},{"case_id":"ols-rcs-explicit","profile":"well-conditioned-ols-v1","outcome":"passed","exact_comparisons":19,"numeric_comparisons":76,"maximum_absolute_error":1.021405182655144e-14,"maximum_relative_error":2.2730099638088368e-14,"mismatches":[]},{"case_id":"ols-rcs-five-knots","profile":"well-conditioned-ols-v1","outcome":"passed","exact_comparisons":23,"numeric_comparisons":115,"maximum_absolute_error":1.4654943925052066e-13,"maximum_relative_error":1.3893475916597886e-13,"mismatches":[]},{"case_id":"ols-rcs-fractional","profile":"well-conditioned-ols-v1","outcome":"passed","exact_comparisons":19,"numeric_comparisons":81,"maximum_absolute_error":9.769962616701378e-15,"maximum_relative_error":3.088215638907642e-14,"mismatches":[]},{"case_id":"ols-rcs-linear-signal","profile":"well-conditioned-ols-v1","outcome":"passed","exact_comparisons":19,"numeric_comparisons":81,"maximum_absolute_error":7.105427357601002e-15,"maximum_relative_error":5.750852837135746e-13,"mismatches":[]},{"case_id":"ols-rcs-quadratic-shape","profile":"well-conditioned-ols-v1","outcome":"passed","exact_comparisons":19,"numeric_comparisons":81,"maximum_absolute_error":5.329070518200751e-15,"maximum_relative_error":8.549589145451068e-14,"mismatches":[]},{"case_id":"rcs-asymmetric","profile":"deterministic-transform-v1","outcome":"passed","exact_comparisons":24,"numeric_comparisons":27,"maximum_absolute_error":5.329070518200751e-15,"maximum_relative_error":6.055761952500849e-16,"mismatches":[]},{"case_id":"rcs-explicit","profile":"deterministic-transform-v1","outcome":"passed","exact_comparisons":26,"numeric_comparisons":33,"maximum_absolute_error":5.329070518200751e-15,"maximum_relative_error":7.751375299201087e-16,"mismatches":[]},{"case_id":"rcs-five-knots","profile":"deterministic-transform-v1","outcome":"passed","exact_comparisons":30,"numeric_comparisons":44,"maximum_absolute_error":7.105427357601002e-15,"maximum_relative_error":7.105427357600996e-16,"mismatches":[]},{"case_id":"rcs-fractional","profile":"deterministic-transform-v1","outcome":"passed","exact_comparisons":24,"numeric_comparisons":27,"maximum_absolute_error":8.881784197001252e-16,"maximum_relative_error":3.497896416959632e-16,"mismatches":[]},{"case_id":"rcs-three-knots","profile":"deterministic-transform-v1","outcome":"passed","exact_comparisons":20,"numeric_comparisons":18,"maximum_absolute_error":3.552713678800501e-15,"maximum_relative_error":4.736951571733999e-16,"mismatches":[]},{"case_id":"rcs-wide-range","profile":"deterministic-transform-v1","outcome":"passed","exact_comparisons":24,"numeric_comparisons":27,"maximum_absolute_error":1.4210854715202004e-13,"maximum_relative_error":7.201446646217226e-16,"mismatches":[]}],"summary":{"outcome":"passed","case_count":12,"failed_case_count":0,"maximum_absolute_error":1.4654943925052066e-13,"maximum_relative_error":5.750852837135746e-13}}
